Numéro d'école;Latitude;Longitude;
0240807X;45.424362;0.8631506;Saint-Romain-et-Saint-Clément, Nontron, Dordogne, Nouvelle-Aquitaine, France métropolitaine, 24800, France
0240920V;45.1970172;0.7835042;Trélissac, Périgueux, Dordogne, Nouvelle-Aquitaine, France métropolitaine, 24750, France
0240955H;44.8534568;0.487531;Bergerac, Dordogne, Nouvelle-Aquitaine, France métropolitaine, 24100, France
0240990W;44.8704188;0.3742764;La Force, Bergerac, Dordogne, Nouvelle-Aquitaine, France métropolitaine, 24130, France
0241013W;44.8456284;0.9082579;Le Buisson-de-Cadouin, Bergerac, Dordogne, Nouvelle-Aquitaine, France métropolitaine, 24480, France
0241115G;45.5705556;0.5613889;Javerlhac-et-la-Chapelle-Saint-Robert, Nontron, Dordogne, Nouvelle-Aquitaine, France métropolitaine, 24300, France
0241123R;45.29233;0.74936;Agonac, Périgueux, Dordogne, Nouvelle-Aquitaine, France métropolitaine, 24460, France
0241133B;44.74607125;0.975186732678294;Belvès, Pays-de-Belvès, Sarlat-la-Canéda, Dordogne, Nouvelle-Aquitaine, France métropolitaine, 24170, France
0250343M;47.2362653;6.647865;Chamesey, Pontarlier, Doubs, Bourgogne-Franche-Comté, France métropolitaine, 25380, France
0250395U;47.2574922;6.7027625;Cour-Saint-Maurice, Montbéliard, Doubs, Bourgogne-Franche-Comté, France métropolitaine, 25380, France
0020894L;49.0614202;3.5731984;Passy-sur-Marne, Château-Thierry, Aisne, Hauts-de-France, France métropolitaine, 02850, France
0020944R;49.0904983;3.5358892;Jaulgonne, Château-Thierry, Aisne, Hauts-de-France, France métropolitaine, 02850, France
0021699L;49.8486111;3.2863888;Saint-Quentin, Aisne, Hauts-de-France, France métropolitaine, 02100, France
0140210C;49.2482981;-1.0452622;Lison, Bayeux, Calvados, Normandie, France métropolitaine, 14330, France
0250935F;47.2785585;6.7352213;Vauclusotte, Montbéliard, Doubs, Bourgogne-Franche-Comté, France métropolitaine, 25380, France
0260138J;44.5159006;5.2154189;Bouvières, Nyons, Drôme, Auvergne-Rhône-Alpes, France métropolitaine, 26460, France
0260659A;44.9332277;4.8920811;Valence, Drôme, Auvergne-Rhône-Alpes, France métropolitaine, 26000, France
0511234P;48.9894458;4.3154379;Recy, Châlons-en-Champagne, Marne, Grand Est, France métropolitaine, 51520, France
0511831N;49.3284469;3.9453038;Villers-Franqueux, Reims, Marne, Grand Est, France métropolitaine, 51220, France
0512106M;49.0279127;4.2372528;Vraux, Châlons-en-Champagne, Marne, Grand Est, France métropolitaine, 51150, France
0520103E;48.4426265;5.1412535;Joinville, Saint-Dizier, Haute-Marne, Grand Est, France métropolitaine, 52300, France
0520609E;48.1435047;5.1444736;Condes, Chaumont, Haute-Marne, Grand Est, France métropolitaine, 52000, France
0520909F;48.2952568;5.2464882093597;Roches-Bettaincourt, Saint-Dizier, Haute-Marne, Grand Est, France métropolitaine, 52270, France
0221482S;48.28993035;-2.52601251185113;Collinée, Le Mené, Saint-Brieuc, Côtes-d'Armor, Bretagne, France métropolitaine, 22330, France
0221602X;48.6787936;-3.5231644;Ploumilliau, Lannion, Côtes-d'Armor, Bretagne, France métropolitaine, 22300, France
0240271P;45.1909365;0.7184407;Périgueux, Dordogne, Nouvelle-Aquitaine, France métropolitaine, 24000, France
0240304A;44.8534568;0.487531;Bergerac, Dordogne, Nouvelle-Aquitaine, France métropolitaine, 24100, France
0240334H;44.64023;1.03398;Saint-Cernin-de-l'Herm, Sarlat-la-Canéda, Dordogne, Nouvelle-Aquitaine, France métropolitaine, 24550, France
0240383L;44.90528;0.54942;Queyssac, Bergerac, Dordogne, Nouvelle-Aquitaine, France métropolitaine, 24140, France
0240402G;45.4287117;0.7046508;Quinsac, Nontron, Dordogne, Nouvelle-Aquitaine, France métropolitaine, 24530, France
0240403H;45.32447;0.77998;Saint-Front-d'Alemps, Nontron, Dordogne, Nouvelle-Aquitaine, France métropolitaine, 24460, France
0140379L;49.1828008;-0.3690815;Caen, Calvados, Normandie, France métropolitaine, 14000, France
0140421G;49.1828008;-0.3690815;Caen, Calvados, Normandie, France métropolitaine, 14000, France
0140643Y;48.8964741;-0.1999129;Falaise, Caen, Calvados, Normandie, France métropolitaine, 14700, France
0140676J;48.8784406;-0.160385;La Hoguette, Caen, Calvados, Normandie, France métropolitaine, 14700, France
0141377W;48.84902185;-0.565216636395482;Condé-sur-Noireau, Condé-en-Normandie, Vire, Calvados, Normandie, France métropolitaine, 14110, France
0141563Y;49.1828008;-0.3690815;Caen, Calvados, Normandie, France métropolitaine, 14000, France
0141691M;49.2764624;-0.7024738;Bayeux, Calvados, Normandie, France métropolitaine, 14400, France
0142016R;49.1129522;-0.4724922;Esquay-Notre-Dame, Caen, Calvados, Normandie, France métropolitaine, 14210, France
0312623H;43.6044622;1.4442469;Toulouse, Haute-Garonne, Occitanie, France métropolitaine, France
0320247V;43.9218218;0.8012234;Saint-Créac, Condom, Gers, Occitanie, France métropolitaine, 32380, France
0320453U;43.6397222;-0.0222222;Cahuzac-sur-Adour, Mirande, Gers, Occitanie, France métropolitaine, 32400, France
0320464F;43.9752122;0.6099933;Castéra-Lectourois, Condom, Gers, Occitanie, France métropolitaine, 32700, France
0240584E;45.1724869;0.765034783995843;Boulazac, Boulazac Isle Manoire, Périgueux, Dordogne, Nouvelle-Aquitaine, France métropolitaine, 24750, France
0240632G;45.3583333;0.3394444;Saint-Martial-Viveyrol, Périgueux, Dordogne, Nouvelle-Aquitaine, France métropolitaine, 24320, France
0240682L;44.8456284;0.9082579;Le Buisson-de-Cadouin, Bergerac, Dordogne, Nouvelle-Aquitaine, France métropolitaine, 24480, France
0240716Y;44.8320108;1.3100538;Veyrignac, Sarlat-la-Canéda, Dordogne, Nouvelle-Aquitaine, France métropolitaine, 24370, France
0241117J;45.1382681;0.752132860790254;Atur, Boulazac Isle Manoire, Périgueux, Dordogne, Nouvelle-Aquitaine, France métropolitaine, 24750, France
0250495C;47.1683558;6.8263552;Fournet-Blancheroche, Montbéliard, Doubs, Bourgogne-Franche-Comté, France métropolitaine, 25140, France
0140671D;48.9399409;-0.2547982;Villers-Canivet, Caen, Calvados, Normandie, France métropolitaine, 14420, France
0150174H;44.89699475;2.23210010809926;Pers, Le Rouget-Pers, Aurillac, Cantal, Auvergne-Rhône-Alpes, France métropolitaine, 15290, France
0142135V;49.3693155;0.274869;Genneville, Lisieux, Calvados, Normandie, France métropolitaine, 14600, France
0142157U;49.24874435;-0.602242244099141;Martragny, Moulins en Bessin, Bayeux, Calvados, Normandie, France métropolitaine, 14740, France
0150311G;45.0534808;2.1477305;Cros-de-Montvert, Aurillac, Cantal, Auvergne-Rhône-Alpes, France métropolitaine, 15150, France
0150425F;44.9285441;2.4433101;Aurillac, Cantal, Auvergne-Rhône-Alpes, France métropolitaine, 15000, France
0150692W;44.9642272;2.4898166;Saint-Simon, Aurillac, Cantal, Auvergne-Rhône-Alpes, France métropolitaine, 15130, France
0030330T;46.5660526;3.3331703;Moulins, Allier, Auvergne-Rhône-Alpes, France métropolitaine, 03000, France
0320585M;43.6463558;0.5850507;Auch, Gers, Occitanie, France métropolitaine, 32000, France
0550991D;48.6452957;5.3394095;Longeaux, Bar-le-Duc, Meuse, Grand Est, France métropolitaine, 55500, France
0160197C;45.3235749;0.1899025;Pillac, Angoulême, Charente, Nouvelle-Aquitaine, France métropolitaine, 16390, France
0030616D;46.1324239;3.4602736;Cusset, Vichy, Allier, Auvergne-Rhône-Alpes, France métropolitaine, 03300, France
0030740N;46.3464789733877;3.83059344224151;Le Donjon, Auvergne-Rhône-Alpes, France métropolitaine, 03130, France
0050153P;44.5642457;6.4957085;Embrun, Gap, Hautes-Alpes, Provence-Alpes-Côte d'Azur, France métropolitaine, 05200, France
0212101V;47.7797734;4.8607185;Recey-sur-Ource, Montbard, Côte-d'Or, Bourgogne-Franche-Comté, France métropolitaine, 21290, France
0220484G;48.5141594;-2.7602707;Saint-Brieuc, Côtes-d'Armor, Bretagne, France métropolitaine, 22000, France
0560739Z;47.7119271;-3.3088391;Riantec, Lorient, Morbihan, Bretagne, France métropolitaine, 56670, France
0561415J;48.0647729;-2.9675702;Pontivy, Morbihan, Bretagne, France métropolitaine, 56300, France
0561725W;47.7477336;-3.3660907;Lorient, Morbihan, Bretagne, France métropolitaine, 56100, France
0570406G;49.2647432;6.6277712;Rémering, Forbach-Boulay-Moselle, Moselle, Grand Est, France métropolitaine, 57550, France
0060231U;43.8119541;7.3146204;Contes, Nice, Alpes-Maritimes, Provence-Alpes-Côte d'Azur, France métropolitaine, 06390, France
0221474H;48.74957;-2.9855088;Plouézec, Guingamp, Côtes-d'Armor, Bretagne, France métropolitaine, 22470, France
0240180R;44.8106395;0.823878;Molières, Bergerac, Dordogne, Nouvelle-Aquitaine, France métropolitaine, 24480, France
0270336U;49.0738551;0.4619694;Saint-Mards-de-Fresne, Bernay, Eure, Normandie, France métropolitaine, 27230, France
0270365A;48.8995494;1.2329159;Les Authieux, Évreux, Eure, Normandie, France métropolitaine, 27220, France
0240296S;45.1909365;0.7184407;Périgueux, Dordogne, Nouvelle-Aquitaine, France métropolitaine, 24000, France
0240301X;45.1970172;0.7835042;Trélissac, Périgueux, Dordogne, Nouvelle-Aquitaine, France métropolitaine, 24750, France
0240313K;44.6312198;0.8725428;Biron, Bergerac, Dordogne, Nouvelle-Aquitaine, France métropolitaine, 24540, France
0240419A;45.336641;1.0490102;Excideuil, Nontron, Dordogne, Nouvelle-Aquitaine, France métropolitaine, 24160, France
0240582C;45.1382681;0.752132860790254;Atur, Boulazac Isle Manoire, Périgueux, Dordogne, Nouvelle-Aquitaine, France métropolitaine, 24750, France
0100144C;48.0629678470786;3.91875099874401;Ervy-le-Châtel, Grand Est, France métropolitaine, 10130, France
0100198L;48.502766;4.2738976;Chaudrey, Troyes, Aube, Grand Est, France métropolitaine, 10240, France
0100250T;48.2701237;3.8071497;Estissac, Troyes, Aube, Grand Est, France métropolitaine, 10190, France
0100924A;48.2088406;3.8914306;Bercenay-en-Othe, Troyes, Aube, Grand Est, France métropolitaine, 10190, France
0451199J;47.76351;2.0215;Marcilly-en-Villette, Orléans, Loiret, Centre-Val de Loire, France métropolitaine, 45240, France
0451311F;48.2104339;2.0179646;Outarville, Pithiviers, Loiret, Centre-Val de Loire, France métropolitaine, 45480, France
0460227X;44.5418304;1.0737531;Montcabrier, Cahors, Lot, Occitanie, France métropolitaine, 46700, France
0460271V;44.9898406;1.6634008;Condat, Gourdon, Lot, Occitanie, France métropolitaine, 46110, France
0460401L;44.7841401;1.8513429;Aynac, Figeac, Lot, Occitanie, France métropolitaine, 46120, France
0460419F;44.3770903;1.15333545595511;Belmontet, Montcuq-en-Quercy-Blanc, Cahors, Lot, Occitanie, France métropolitaine, 46800, France
0460600C;44.9971233;1.6389476635401;Les Quatre-Routes-du-Lot, Le Vignon-en-Quercy, Gourdon, Lot, Occitanie, France métropolitaine, 46110, France
0280156T;48.2825990166904;1.65838836542575;Beauvilliers, Centre-Val de Loire, France métropolitaine, 28150, France
0280285H;48.4231;1.46835;Luisant, Chartres, Eure-et-Loir, Centre-Val de Loire, France métropolitaine, 28600, France
0180451T;47.3030026;2.5239669;Henrichemont, Bourges, Cher, Centre-Val de Loire, France métropolitaine, 18250, France
0180588S;46.9921896;2.2552381;Saint-Florent-sur-Cher, Bourges, Cher, Centre-Val de Loire, France métropolitaine, 18400, France
9740951R;-20.9354584;55.2916763;Le Port, Saint-Paul, La Réunion, 97420, France
9760022V;-12.77607895;45.2846124862922;Dzaoudzi, Mayotte, 97610, France
9760028B;-12.9132184;45.194967;Bandrélé, Mayotte, 97620, France
0080345G;49.7429367;4.7462556;Villers-Semeuse, Charleville-Mézières, Ardennes, Grand Est, France métropolitaine, 08000, France
0080520X;49.4254547;4.1764618;Roizy, Rethel, Ardennes, Grand Est, France métropolitaine, 08190, France
0090137A;42.9003627;1.3404767;Boussenac, Saint-Girons, Ariège, Occitanie, France métropolitaine, 09320, France
0170589Y;45.6245332;-1.0287636;Royan, Rochefort, Charente-Maritime, Nouvelle-Aquitaine, France métropolitaine, 17200, France
0110864E;43.2130358;2.3491069;Carcassonne, Aude, Occitanie, France métropolitaine, 11000, France
0120338C;44.5923335;2.42216998397436;Conques, Conques-en-Rouergue, Rodez, Aveyron, Occitanie, France métropolitaine, 12320, France
0120475B;44.476229;2.2295701;Montbazens, Villefranche-de-Rouergue, Aveyron, Occitanie, France métropolitaine, 12220, France
0410098J;47.35296115;1.2239873718126;Bourré, Montrichard Val de Cher, Romorantin-Lanthenay, Loir-et-Cher, Centre-Val de Loire, France métropolitaine, 41400, France
0190375E;45.4065225;2.045018;Égletons, Ussel, Corrèze, Nouvelle-Aquitaine, France métropolitaine, 19300, France
0190547S;45.2335546;1.6974158;Chameyrat, Tulle, Corrèze, Nouvelle-Aquitaine, France métropolitaine, 19330, France
0210472Z;47.290721;4.2946459;Villargoix, Montbard, Côte-d'Or, Bourgogne-Franche-Comté, France métropolitaine, 21210, France
0210509P;47.23017;5.19291;Varanges, Dijon, Côte-d'Or, Bourgogne-Franche-Comté, France métropolitaine, 21110, France
0100796L;48.2784599;4.0507314;Saint-André-les-Vergers, Troyes, Aube, Grand Est, France métropolitaine, 10120, France
0171051A;45.6245332;-1.0287636;Royan, Rochefort, Charente-Maritime, Nouvelle-Aquitaine, France métropolitaine, 17200, France
0180779Z;47.1354385;2.5499221;Sainte-Solange, Bourges, Cher, Centre-Val de Loire, France métropolitaine, 18220, France
0120585W;44.1883973;3.1322855;Rivière-sur-Tarn, Millau, Aveyron, Occitanie, France métropolitaine, 12640, France
0420322X;46.0345572;4.0729178;Roanne, Loire, Auvergne-Rhône-Alpes, France métropolitaine, 42300, France
0420327C;46.0345572;4.0729178;Roanne, Loire, Auvergne-Rhône-Alpes, France métropolitaine, 42300, France
0211333K;47.2089381;5.3531973;Villers-les-Pots, Dijon, Côte-d'Or, Bourgogne-Franche-Comté, France métropolitaine, 21130, France
0211891S;47.2768197;5.1748412;Magny-sur-Tille, Dijon, Côte-d'Or, Bourgogne-Franche-Comté, France métropolitaine, 21110, France
0280792J;48.7358807;1.3684254;Dreux, Eure-et-Loir, Centre-Val de Loire, France métropolitaine, 28100, France
0290512Z;48.4514803;-4.2557901;Landerneau, Brest, Finistère, Bretagne, France métropolitaine, 29800, France
0120719S;44.7373;2.72882;Saint-Symphorien-de-Thénières, Rodez, Aveyron, Occitanie, France métropolitaine, 12460, France
0190145E;45.1584982;1.5332389;Brive-la-Gaillarde, Corrèze, Nouvelle-Aquitaine, France métropolitaine, 19100, France
0190510B;45.4143034;2.4284518;Sarroux, Ussel, Corrèze, Nouvelle-Aquitaine, France métropolitaine, 19110, France
0291163G;47.8126044;-4.3377655;Penmarc'h, Quimper, Finistère, Bretagne, France métropolitaine, 29760, France
0180234G;46.9921896;2.2552381;Saint-Florent-sur-Cher, Bourges, Cher, Centre-Val de Loire, France métropolitaine, 18400, France
0420522P;45.4235;4.06555;Saint-Bonnet-le-Château, Montbrison, Loire, Auvergne-Rhône-Alpes, France métropolitaine, 42380, France
0420673D;45.4401467;4.3873058;Saint-Étienne, Loire, Auvergne-Rhône-Alpes, France métropolitaine, France
0420702K;45.7445684131372;4.22591794358575;Feurs, Auvergne-Rhône-Alpes, France métropolitaine, 42110, France
0420928F;45.6072875;4.0627318;Montbrison, Loire, Auvergne-Rhône-Alpes, France métropolitaine, 42600, France
0420933L;45.5414;4.18354;Sury-le-Comtal, Montbrison, Loire, Auvergne-Rhône-Alpes, France métropolitaine, 42450, France
0290790B;47.9960325;-4.1024782;Quimper, Finistère, Bretagne, France métropolitaine, 29000, France
0061755A;43.833177;7.4723919;Castillon, Nice, Alpes-Maritimes, Provence-Alpes-Côte d'Azur, France métropolitaine, 06500, France
0130487J;43.5139051;4.9884323;Istres, Bouches-du-Rhône, Provence-Alpes-Côte d'Azur, France métropolitaine, 13800, France
0422101F;45.4401467;4.3873058;Saint-Étienne, Loire, Auvergne-Rhône-Alpes, France métropolitaine, France
0430413R;45.1189171;3.9065257;Lavoûte-sur-Loire, Pays du Velay, Haute-Loire, Auvergne-Rhône-Alpes, France métropolitaine, 43800, France
0160196B;45.4199869;0.0564999;Nonac, Angoulême, Charente, Nouvelle-Aquitaine, France métropolitaine, 16190, France
0160561Y;45.7078066;0.5547653;Rouzède, Angoulême, Charente, Nouvelle-Aquitaine, France métropolitaine, 16220, France
0071178T;45.2399639;4.6675475;Annonay, Tournon-sur-Rhône, Ardèche, Auvergne-Rhône-Alpes, France métropolitaine, 07100, France
0090111X;43.1661872;1.2755831;La Bastide-de-Besplas, Saint-Girons, Ariège, Occitanie, France métropolitaine, 09350, France
0100095Z;48.2514482840827;4.70577699728286;Ailleville, Grand Est, France métropolitaine, 10200, France
0100227T;47.9958509;3.8643686;Les Croûtes, Troyes, Aube, Grand Est, France métropolitaine, 10130, France
0100412U;48.5185158;3.5955059;Pont-sur-Seine, Nogent-sur-Seine, Aube, Grand Est, France métropolitaine, 10400, France
0100465B;48.2784599;4.0507314;Saint-André-les-Vergers, Troyes, Aube, Grand Est, France métropolitaine, 10120, France
0351787C;48.0181129;-1.651345;Saint-Erblon, Rennes, Ille-et-Vilaine, Bretagne, France métropolitaine, 35230, France
0352095M;48.3683827;-1.2177018;Lécousse, Fougères-Vitré, Ille-et-Vilaine, Bretagne, France métropolitaine, 35133, France
0360241S;46.9477826;1.9889131;Issoudun, Indre, Centre-Val de Loire, France métropolitaine, 36100, France
0360484F;46.4280912;2.0528147;Sazeray, La Châtre, Indre, Centre-Val de Loire, France métropolitaine, 36160, France
0292028X;47.8201167;-3.7921065;Névez, Quimper, Finistère, Bretagne, France métropolitaine, 29920, France
0170436G;46.1591126;-1.1520434;La Rochelle, Charente-Maritime, Nouvelle-Aquitaine, France métropolitaine, 17000, France
9710152N;16.2408636;-61.5334077;Pointe-à-Pitre, Guadeloupe, 97110, France
9710389W;16.3316709;-61.3476233;Le Moule, Pointe-à-Pitre, Guadeloupe, 97160, France
9710492H;16.3776349;-61.4877837;Petit-Canal, Pointe-à-Pitre, Guadeloupe, 97131, France
9710497N;16.2255854;-61.3857557;Sainte-Anne, Pointe-à-Pitre, Guadeloupe, 97180, France
0110176G;43.2130358;2.3491069;Carcassonne, Aude, Occitanie, France métropolitaine, 11000, France
0110651Y;43.2108325;2.4412579;Trèbes, Carcassonne, Aude, Occitanie, France métropolitaine, 11800, France
0260940F;45.0458886;5.0528681;Romans-sur-Isère, Valence, Drôme, Auvergne-Rhône-Alpes, France métropolitaine, 26100, France
0261028B;44.9332277;4.8920811;Valence, Drôme, Auvergne-Rhône-Alpes, France métropolitaine, 26000, France
0270863S;48.90859715;1.16407407793467;Thomer-la-Sôgne, Chambois, Bernay, Eure, Normandie, France métropolitaine, 27240, France
0571959V;49.034658;6.1569029;Coin-lès-Cuvry, Metz, Moselle, Grand Est, France métropolitaine, 57420, France
0572137N;49.1196964;6.1763552;Metz, Moselle, Grand Est, France métropolitaine, France
0572314F;49.3086945;6.5876744;Heining-lès-Bouzonville, Forbach-Boulay-Moselle, Moselle, Grand Est, France métropolitaine, 57320, France
0671974G;48.8519787;7.61247138699397;La Walck, Val-de-Moder, Haguenau-Wissembourg, Bas-Rhin, Grand Est, France métropolitaine, 67350, France
0672452B;48.3966676;7.4425002;Mittelbergheim, Sélestat-Erstein, Bas-Rhin, Grand Est, France métropolitaine, 67140, France
0672620J;48.4553525;7.2068703;Rothau, Molsheim, Bas-Rhin, Grand Est, France métropolitaine, 67570, France
0111002E;43.0202133;2.391578;Villardebelle, Limoux, Aude, Occitanie, France métropolitaine, 11580, France
0160187S;45.348474;0.2491546;Palluaud, Angoulême, Charente, Nouvelle-Aquitaine, France métropolitaine, 16390, France
0160287A;45.6763498;0.2188754;Ruelle-sur-Touvre, Angoulême, Charente, Nouvelle-Aquitaine, France métropolitaine, 16600, France
0160449B;45.7594369;0.1278348;Vars, Confolens, Charente, Nouvelle-Aquitaine, France métropolitaine, 16330, France
0160529N;46.0316836;0.7211031;Esse, Confolens, Charente, Nouvelle-Aquitaine, France métropolitaine, 16500, France
0280310K;48.4231;1.46835;Luisant, Chartres, Eure-et-Loir, Centre-Val de Loire, France métropolitaine, 28600, France
0572592H;49.1492922;6.9490582;Bousbach, Forbach-Boulay-Moselle, Moselle, Grand Est, France métropolitaine, 57460, France
0572687L;49.1198867;6.28799840269698;Montoy-Flanville, Ogy-Montoy-Flanville, Metz, Moselle, Grand Est, France métropolitaine, 57645, France
0572781N;49.2515048;6.0938369;Rombas, Metz, Moselle, Grand Est, France métropolitaine, 57120, France
0681387N;47.7569173878324;7.28891668465197;Lutterbach, Grand Est, France métropolitaine, 68210, France
0681512Z;47.7627813;7.1529679;Aspach-le-Bas, Thann-Guebwiller, Haut-Rhin, Grand Est, France métropolitaine, 68700, France
0160851N;45.9935688;0.6461785;Ansac-sur-Vienne, Confolens, Charente, Nouvelle-Aquitaine, France métropolitaine, 16500, France
0161030H;46.0120389;0.0795577;Villefagnan, Confolens, Charente, Nouvelle-Aquitaine, France métropolitaine, 16240, France
0161129R;45.7750157;0.2093391;Anais, Confolens, Charente, Nouvelle-Aquitaine, France métropolitaine, 16560, France
0410893Y;48.0406043;1.076786;Droué, Vendôme, Loir-et-Cher, Centre-Val de Loire, France métropolitaine, 41270, France
0420326B;46.0345572;4.0729178;Roanne, Loire, Auvergne-Rhône-Alpes, France métropolitaine, 42300, France
0420377G;45.4348987;4.3212622;Roche-la-Molière, Saint-Étienne, Loire, Auvergne-Rhône-Alpes, France métropolitaine, 42230, France
0420652F;45.4401467;4.3873058;Saint-Étienne, Loire, Auvergne-Rhône-Alpes, France métropolitaine, France
0670207L;48.2422436;7.3799809;Orschwiller, Sélestat-Erstein, Bas-Rhin, Grand Est, France métropolitaine, 67600, France
0670220A;48.5425109;7.7102193;Ostwald, Strasbourg, Bas-Rhin, Grand Est, France métropolitaine, 67540, France
0670292D;48.584614;7.7507127;Strasbourg, Bas-Rhin, Grand Est, France métropolitaine, France
0670364G;48.9012785;7.9757435;Hatten, Haguenau-Wissembourg, Bas-Rhin, Grand Est, France métropolitaine, 67690, France
0671099F;48.71944845;7.58331394234607;Gingsheim, Wingersheim les Quatre Bans, Saverne, Bas-Rhin, Grand Est, France métropolitaine, 67270, France
0420961S;46.0205;4.09203;Le Coteau, Roanne, Loire, Auvergne-Rhône-Alpes, France métropolitaine, 42120, France
0421190R;46.0345572;4.0729178;Roanne, Loire, Auvergne-Rhône-Alpes, France métropolitaine, 42300, France
0421472X;45.4401467;4.3873058;Saint-Étienne, Loire, Auvergne-Rhône-Alpes, France métropolitaine, France
0421529J;45.4401467;4.3873058;Saint-Étienne, Loire, Auvergne-Rhône-Alpes, France métropolitaine, France
0421988H;45.4401467;4.3873058;Saint-Étienne, Loire, Auvergne-Rhône-Alpes, France métropolitaine, France
0830730T;43.1007714;5.8788948;La Seyne-sur-Mer, Toulon, Var, Provence-Alpes-Côte d'Azur, France métropolitaine, 83500, France
0671470J;48.9404465;7.0899329;Sarre-Union, Saverne, Bas-Rhin, Grand Est, France métropolitaine, 67260, France
0671521P;48.9894363;8.0441146;Schleithal, Haguenau-Wissembourg, Bas-Rhin, Grand Est, France métropolitaine, 67160, France
0480362H;44.1998;3.92277;Saint-Martin-de-Boubaux, Florac, Lozère, Occitanie, France métropolitaine, 48160, France
0311118X;43.4599858;1.3262332;Muret, Haute-Garonne, Occitanie, France métropolitaine, 31600, France
0490099S;47.4739884;-0.5515588;Angers, Maine-et-Loire, Pays de la Loire, France métropolitaine, France
0890470C;48.0201831;3.8050892;Beugnon, Auxerre, Yonne, Bourgogne-Franche-Comté, France métropolitaine, 89570, France
0890993W;47.9411544;3.1309538;Villefranche, Auxerre, Yonne, Bourgogne-Franche-Comté, France métropolitaine, 89120, France
0891081S;47.7741815;3.7546243;Courgis, Auxerre, Yonne, Bourgogne-Franche-Comté, France métropolitaine, 89800, France
0891294Y;47.8634136;3.7279379;Lignorelles, Auxerre, Yonne, Bourgogne-Franche-Comté, France métropolitaine, 89800, France
0900055W;47.7179803;6.9690806;Romagny-sous-Rougemont, Belfort, Territoire-de-Belfort, Bourgogne-Franche-Comté, France métropolitaine, 90110, France
0900095P;47.7418553;6.8251787;Giromagny, Belfort, Territoire-de-Belfort, Bourgogne-Franche-Comté, France métropolitaine, 90200, France
0490989J;47.05249335;-0.878211254509414;Cholet, Maine-et-Loire, Pays de la Loire, France métropolitaine, 49300, France
0681782T;48.0777517;7.3579641;Colmar, Colmar-Ribeauvillé, Haut-Rhin, Grand Est, France métropolitaine, 68000, France
0332316N;44.8931452;-0.1560662;Saint-Émilion, Libourne, Gironde, Nouvelle-Aquitaine, France métropolitaine, 33330, France
0332763Z;44.9259011;-0.4881846;Ambarès-et-Lagrave, Bordeaux, Gironde, Nouvelle-Aquitaine, France métropolitaine, 33440, France
0911135P;48.4824089;2.3476234;La Ferté-Alais, Étampes, Essonne, Île-de-France, France métropolitaine, 91590, France
0020597N;49.9216667;3.4030556;Croix-Fonsomme, Saint-Quentin, Aisne, Hauts-de-France, France métropolitaine, 02110, France
0020868H;49.8486111;3.2863888;Saint-Quentin, Aisne, Hauts-de-France, France métropolitaine, 02100, France
0311650A;43.6828953;1.31799;Aussonne, Toulouse, Haute-Garonne, Occitanie, France métropolitaine, 31840, France
0320158Y;43.3525;0.5125;Monlaur-Bernet, Mirande, Gers, Occitanie, France métropolitaine, 32140, France
0320307K;43.6520371776118;-0.108233505206338;Riscle, Occitanie, France métropolitaine, 32400, France
0320317W;43.4613889;0.2158333;Troncens, Mirande, Gers, Occitanie, France métropolitaine, 32230, France
0320462D;43.9727778;0.4577778;Castelnau-sur-l'Auvignon, Condom, Gers, Occitanie, France métropolitaine, 32100, France
0320611R;43.5479869;0.2945111;Pouylebon, Mirande, Gers, Occitanie, France métropolitaine, 32320, France
0301529Z;43.8629;4.45426;Marguerittes, Nîmes, Gard, Occitanie, France métropolitaine, 30320, France
0330545N;44.8842379;-0.6111474;Bruges, Bordeaux, Gironde, Nouvelle-Aquitaine, France métropolitaine, 33520, France
0331104W;45.1298707;-0.5076217;Saint-Christoly-de-Blaye, Blaye, Gironde, Nouvelle-Aquitaine, France métropolitaine, France
0080513P;49.4578911;4.1032291;Vieux-lès-Asfeld, Rethel, Ardennes, Grand Est, France métropolitaine, 08190, France
0080755C;50.1032047;4.7625256;Aubrives, Charleville-Mézières, Ardennes, Grand Est, France métropolitaine, 08320, France
0081101D;49.4330247;4.0534287;Brienne-sur-Aisne, Rethel, Ardennes, Grand Est, France métropolitaine, 08190, France
